{"$schema":"https://json-schema.org/draft/2020-12/schema","$id":"approved-figure.schema.json","type":"object","additionalProperties":false,"required":["schema_version","approval_id","manifest_id","manifest_hash","critic_report_id","critic_report_hash","figure_revision","approval_status","executed_static_critic"],"properties":{"schema_version":{"const":"1.0.0"},"approval_id":{"type":"string"},"manifest_id":{"type":"string"},"manifest_hash":{"type":"string","pattern":"^[a-f0-9]{64}$"},"critic_report_id":{"type":"string"},"critic_report_hash":{"type":"string","pattern":"^[a-f0-9]{64}$"},"figure_revision":{"type":"string"},"approval_status":{"const":"APPROVED_FIGURE"},"executed_static_critic":{"const":true}}}
