[
  {
    "schema_version": "1.0.0",
    "approval_id": "APF-FIG002-001",
    "manifest_id": "FOM-FIG002-001",
    "manifest_hash": "709951f6378a90ac5c9718d888f4baf3de8cd86ec76da628d18d0acaa6deb8b4",
    "critic_report_id": "FCR-FIG002-001",
    "critic_report_hash": "0859e253176c06422b90ed10658c09f250e641a1eee048e545cb6de4e1b99698",
    "figure_revision": "1",
    "approval_status": "APPROVED_FIGURE",
    "executed_static_critic": true
  },
  {
    "schema_version": "1.0.0",
    "approval_id": "APF-FIG006-001",
    "manifest_id": "FOM-FIG006-001",
    "manifest_hash": "238f8a8395d1152e0fb76c3ab806106aeb9bfbda63e45e3f4b71f52edf04ec10",
    "critic_report_id": "FCR-FIG006-001",
    "critic_report_hash": "d31d22739b4b676107148237eded4b62c99169ec47bdd52bd8e78669e76efce3",
    "figure_revision": "1",
    "approval_status": "APPROVED_FIGURE",
    "executed_static_critic": true
  },
  {
    "schema_version": "1.0.0",
    "approval_id": "APF-FIG007-001",
    "manifest_id": "FOM-FIG007-001",
    "manifest_hash": "c05fe30691667acbaeddd0e493ff3385258907a2cae70fa0f0e3b2c907af805a",
    "critic_report_id": "FCR-FIG007-001",
    "critic_report_hash": "fcfd621717188fc119cff3798b20ec2a64ce9149cb95961f21344da83ee54a34",
    "figure_revision": "1",
    "approval_status": "APPROVED_FIGURE",
    "executed_static_critic": true
  },
  {
    "schema_version": "1.0.0",
    "approval_id": "APF-FIG003-001",
    "manifest_id": "FOM-FIG003-001",
    "manifest_hash": "9d30c658c72ccf2217d3ce7236008c25cf59144753d6b9766cd413e6c9cd30c4",
    "critic_report_id": "FCR-FIG003-001",
    "critic_report_hash": "4e6f814876a71416a4192cc7713bc3cb4d13cdb13fa4b760cae2bf101f61db6f",
    "figure_revision": "1",
    "approval_status": "APPROVED_FIGURE",
    "executed_static_critic": true
  },
  {
    "schema_version": "1.0.0",
    "approval_id": "APF-FIG008-001",
    "manifest_id": "FOM-FIG008-001",
    "manifest_hash": "075c2e99262aca71ade7be235b5f7a4532c54b0dfb70fc86b771094755cbd98b",
    "critic_report_id": "FCR-FIG008-001",
    "critic_report_hash": "2e341b2e44bafaa160fb8b04ccb5a520594d45c389baa66b811520d74428a879",
    "figure_revision": "1",
    "approval_status": "APPROVED_FIGURE",
    "executed_static_critic": true
  }
]
